{
  "schema_version": "1.0.0",
  "event_id": "event-01k4nexus001",
  "trace_id": "trace-01k4nexus001",
  "device_id": "nexus-demo-esp32",
  "event_type": "verification.passed",
  "occurred_at": "2026-09-08T10:00:06Z",
  "source": "verify",
  "severity": "info",
  "summary": "Motor test completed inside the safe electrical envelope.",
  "payload": {
    "before_sample_id": "nexus-demo-esp32-1042",
    "after_sample_id": "nexus-demo-esp32-1045",
    "observed_current_ma": 812.0,
    "passed_checks": ["current_below_limit", "voltage_above_minimum"]
  },
  "related_tool_call_id": "tool-01k4nexus001"
}
